page_url,page_type,priority,target_frequency,primary_keyword,secondary_keyword_1,secondary_keyword_2,secondary_keyword_3,keyword_cluster,location_modifier,search_intent
/,Core,High,Weekly,NDIS provider Shepparton,NDIS Shepparton,NDIS service provider Shepparton,disability support services Shepparton,Brand + Core Service,Shepparton,Commercial
/registered-ndis-provider-shepparton,Money Page,High,Weekly,registered NDIS provider in Shepparton,NDIS providers Shepparton,NDIS provider Shepparton checklist,best NDIS provider Shepparton,Provider Comparison,Shepparton,Commercial
/our-services,Core,High,Monthly,NDIS services Shepparton,shepparton disability services,disability services Shepparton,NDIS support services near me,Service Hub,Shepparton,Commercial
/dailylivingin-homesupport,Service,High,Weekly,NDIS daily living support Shepparton,in-home disability support Shepparton,personal care NDIS Shepparton,daily living assistance NDIS,Daily Living,Shepparton,Commercial
/communitynursingandcomplexcare,Service,High,Weekly,community nursing NDIS Shepparton,community nursing care Shepparton,NDIS complex nursing care,clinical disability support Shepparton,Nursing + Complex Care,Shepparton,Commercial
/physiotherapyservices,Service,Medium,Monthly,NDIS physiotherapy Shepparton,physiotherapy Shepparton,physio Shepparton,NDIS home physiotherapy,Allied Health Physio,Shepparton,Commercial
/communityparticipationgroupprograms,Service,Medium,Monthly,NDIS community participation Shepparton,NDIS group programs Shepparton,NDIS social groups,social support disability Shepparton,Community Participation,Shepparton,Commercial
/companion-care-services,Service,Medium,Monthly,companionship services Shepparton,NDIS companionship Shepparton,social support worker Shepparton,disability companionship services,Companionship,Shepparton,Commercial
/ndis-transport-service-provider,Service,Medium,Monthly,NDIS transport provider Shepparton,NDIS transport Shepparton,disability transport Shepparton,NDIS travel assistance Shepparton,Transport,Shepparton,Commercial
/ndis-hydrotherapy-services,Service,Medium,Monthly,NDIS hydrotherapy Shepparton,hydrotherapy NDIS,hydrotherapy pool sessions Shepparton,water therapy NDIS,Hydrotherapy,Shepparton,Commercial
/ndispersonaltrainingsessions,Service,Medium,Monthly,NDIS personal training Shepparton,NDIS funded personal training,disability fitness program Shepparton,NDIS exercise support,Personal Training,Shepparton,Commercial
/positivebehavioursupport,Service,Medium,Monthly,positive behaviour support Shepparton,NDIS behaviour support practitioner Shepparton,behaviour support plan NDIS,PBS services Shepparton,Behaviour Support,Shepparton,Commercial
/ndis-cleaning-services,Service,Medium,Monthly,NDIS cleaning services Shepparton,house cleaning Shepparton,NDIS cleaning Shepparton,disability home cleaning Shepparton,Home Cleaning,Shepparton,Commercial
/supported-independent-living-sil-shepparton,Service,High,Weekly,supported independent living Shepparton,SIL vacancies Shepparton,NDIS accommodation Shepparton,supported independent living providers,SIL + Accommodation,Shepparton,Commercial
/ndis-support-coordination,Service,High,Weekly,NDIS support coordination Shepparton,support coordination Shepparton,support coordinator Shepparton,NDIS plan management Shepparton,Support Coordination,Shepparton,Commercial
/contact-us,Conversion,High,Weekly,contact NDIS provider Shepparton,NDIS referral Shepparton,Bright Support contact,disability support enquiry Shepparton,Brand Contact,Shepparton,Transactional
/about-us,Trust,Low,Monthly,Bright Support Shepparton,Bright Support,Bright Support services,shepparton disability services,Brand Trust,Shepparton,Navigational
/blog,Content Hub,Medium,Monthly,NDIS blog Shepparton,NDIS guides Shepparton,disability support resources Victoria,NDIS Shepparton updates,Informational Hub,Shepparton,Informational
/landing/ndis-support,Landing,High,Weekly,NDIS support Shepparton,NDIS Shepparton,fast NDIS intake Shepparton,NDIS service provider Shepparton,Lead Generation,Shepparton,Transactional
/career,Recruitment,Low,Monthly,NDIS careers Shepparton,disability support worker jobs Shepparton,community nursing jobs Shepparton,allied health jobs Shepparton,Recruitment,Shepparton,Informational
